### ISSUE TITLE
Enclave launch hangs/fails with enabled networking (on kernel 5.*)

### ISSUE THREAD

**Issue by t1470** [lsds/sgx-lkl#60]
I am currently trying to make my enclave available on the public network. For that purpose I made a script that sets up the environment (setting all iptable rules and creating a tap device as is described in the readme). In the past, this has worked fine. After rebooting one time, I had to reinstall the SGX drivers because the device was unavailable.

Ever since, the enclave will not launch if I set the SGXLKL_TAP to the tap name, but does if I don't. It just produces no output and hangs forever. With SGXLKL_VERBOSE and SGXLKL_TRACE_LKL_SYSCALL turned on, I see this output **without** networking (works, but not available from outside):

```
[    SGX-LKL   ] No tap device specified, networking will not be available.
[    SGX-LKL   ] No IAS SPID provided, enclave quote will not be verifiable by IAS.
[    SGX-LKL   ] Maximum enclave threads (TCS): 8
[    SGX-LKL   ] Kernel command line: ""
[    SGX-LKL   ] Adding entropy to entropy pool.
[  LKL SYSCALL ] [tid=1  ] openat	56	(-100, /proc/sys/kernel/random/poolsize, 0, 438) = 3 
[  LKL SYSCALL ] [tid=1  ] read	63	(3, 140238422773200, 1024, 0, 0, 0) = 5
[  LKL SYSCALL ] [tid=1  ] openat	56	(-100, /dev/random, 0, 0) = 4 
[  LKL SYSCALL ] [tid=1  ] ioctl	29	(4, 1074287107, 140238422774240, 0, 0, 0) = 0
[  LKL SYSCALL ] [tid=1  ] close	57	(3, 0, 0, 0, 0, 0) = 0
[  LKL SYSCALL ] [tid=1  ] close	57	(4, 0, 0, 0, 0, 0) = 0
[  LKL SYSCALL ] [tid=1  ] openat	56	(-100, /dev/urandom, 0, 0) = 3 
[  LKL SYSCALL ] [tid=1  ] read	63	(3, 140238466829832, 32, 0, 0, 0) = 32
[  LKL SYSCALL ] [tid=1  ] close	57	(3, 0, 0, 0, 0, 0) = 0
[  LKL SYSCALL ] [tid=1  ] socket	198	(16, 3, 0, 0, 0, 0) = 3
[  LKL SYSCALL ] [tid=1  ] bind	200	(3, 140238429601764, 12, 0, 0, 0) = 0
[  LKL SYSCALL ] [tid=1  ] getsockname	204	(3, 140238429601764, 140238466829608, 0, 0, 0) = 0
[  LKL SYSCALL ] [tid=1  ] sendto	206	(3, 140238422229024, 60, 0, 140238472780392, 12) = 60
[  LKL SYSCALL ] [tid=1  ] recvmsg	212	(3, 140238466829376, 0, 0, 0, 0) = 36
...
truncated
```

but with SGXLKL_TAP set to the name of the correctly configured tap device, the output stops after this:

```
[    SGX-LKL   ] No IAS SPID provided, enclave quote will not be verifiable by IAS.
[    SGX-LKL   ] Maximum enclave threads (TCS): 8
[    SGX-LKL   ] Kernel command line: ""
[    SGX-LKL   ] Adding entropy to entropy pool.
[  LKL SYSCALL ] [tid=1  ] openat	56	(-100, /proc/sys/kernel/random/poolsize, 0, 438) = 3 
[  LKL SYSCALL ] [tid=1  ] read	63	(3, 139835769589936, 1024, 0, 0, 0) = 5
[  LKL SYSCALL ] [tid=1  ] openat	56	(-100, /dev/random, 0, 0) = 4 
[  LKL SYSCALL ] [tid=1  ] ioctl	29	(4, 1074287107, 139835769590976, 0, 0, 0) = 0
[  LKL SYSCALL ] [tid=1  ] close	57	(3, 0, 0, 0, 0, 0) = 0
[  LKL SYSCALL ] [tid=1  ] close	57	(4, 0, 0, 0, 0, 0) = 0

```

I am using the standard sgx-lkl-java wrapper. I have tried reinstalling all intel SGX software and sgx-lkl multiple times in multiple modes, but to no avail. The network rules are exactly as described in the readme. When I run tcpdump -i sgxlkl_tap0, I see this traffic directly after trying to start the enclave:

```
08:48:36.508278 IP6 :: > ff02::16: HBH ICMP6, multicast listener report v2, 1 group record(s), length 28
08:48:37.028283 IP6 :: > ff02::16: HBH ICMP6, multicast listener report v2, 1 group record(s), length 28
08:48:37.028298 IP6 :: > ff02::1:ff39:ec13: ICMP6, neighbor solicitation, who has MainComputer, length 32
08:48:38.052305 IP6 MainComputer > ff02::16: HBH ICMP6, multicast listener report v2, 1 group record(s), length 28
08:48:38.052314 IP6 MainComputer > ip6-allrouters: ICMP6, router solicitation, length 16
08:48:38.064276 IP6 MainComputer > ff02::16: HBH ICMP6, multicast listener report v2, 1 group record(s), length 28
08:48:41.828281 IP6 MainComputer > ip6-allrouters: ICMP6, router solicitation, length 16
```

Only thing I now can think of is that the enclave cannot get an attestation because it uses IPV6 but iptables is only configured with IPV4 rules. I don't know what to do now or if I'm missing something obvious.

Thank you for your time.

**Comment by cpriebe** [comment]
Hey @t1470,

Thanks a lot for reporting this! Someone else has recently reported similar issues after upgrading from Ubuntu 18.04.2 to 18.04.3 and with that to a 5.x kernel. Downgrading to a 4.18 kernel helped in that case. Of course that would just be a temporary fix. I am currently working on reproducing the issue.

As a first step, could you let us know which OS you are running?

**Comment by t1470** [comment]
Hi cpriebe,

Thanks for the swift reply. I am running Ubuntu 18.04.2 LTS, and a custom kernel (5.0.0-1016-azure) running on an Azure server. I did not actively upgrade the kernel, although I remember having seen the something like 4.*-azure. Maybe the VM has been auto-upgraded. I will try downgrading and report back if the issue persists.

Thank you.

**Comment by t1470** [comment]
Hi @cpriebe,

By downgrading the kernel version to 4.18.0-1024-azure everything is working again. The kernel upgrade also turned out to be the reason why the isgx device became unavailable and I had to reinstall the sgx driver. In my case, this is a satisfactory solution.

Thank you very much for your fast help! I will leave the issue open, but change the title. Of course, feel free to close the issue.

**Comment by cpriebe** [comment]
Thanks a lot for testing this! That's very helpful. Other people will run into the same issue so it would definitely be good to figure out why 5.x causes problems. It makes sense to leave this open. Thanks for updating the title!

**Comment by cpriebe** [comment]
I have looked into this a bit. The issue appears to be related with the IPv6 Duplicate Address Detection (DAD). I'm not sure why DAD hangs with SGX-LKL on newer kernels though. As there have been other issues with IPv6 (#55), I have decided to revert the recent commit adding IPv6 support (638c4aa) for now.
